{"$schema":"https://json-schema.org/draft/2020-12/schema","$id":"https://example.org/ls/profit_trace_bundle.schema.json","title":"Profit Traceability Bundle V0","type":"object","additionalProperties":false,"required":["schemaVersion","bundleId","product","economicSignal","candidate","decision","businessEvidence","businessOutcome","unitEconomics","record","snapshot"],"properties":{"schemaVersion":{"const":"profit-traceability.bundle.v0"},"bundleId":{"type":"string","pattern":"^PTBIZ-[A-Z0-9-]+$"},"product":{"type":"object","additionalProperties":false,"required":["productId","name"],"properties":{"productId":{"type":"string","pattern":"^PROD-[A-Z0-9-]+$"},"name":{"type":"string","minLength":1}}},"economicSignal":{"$ref":"#/$defs/signal"},"candidate":{"$ref":"#/$defs/candidate"},"decision":{"$ref":"#/$defs/decision"},"businessEvidence":{"type":"array","uniqueItems":true,"items":{"$ref":"#/$defs/evidence"}},"businessOutcome":{"oneOf":[{"type":"null"},{"$ref":"#/$defs/outcome"}]},"unitEconomics":{"oneOf":[{"type":"null"},{"$ref":"#/$defs/economics"}]},"record":{"oneOf":[{"type":"null"},{"$ref":"#/$defs/record"}]},"snapshot":{"$ref":"#/$defs/snapshot"}},"$defs":{"actor":{"type":"string","pattern":"^[a-z0-9][a-z0-9._-]{2,80}$"},"signal":{"type":"object","additionalProperties":false,"required":["id","observedAt","observer","summary","source","confidence"],"properties":{"id":{"type":"string","pattern":"^RSIG-[A-Z0-9-]+$"},"observedAt":{"type":"string","format":"date-time"},"observer":{"$ref":"#/$defs/actor"},"summary":{"type":"string","minLength":10},"source":{"type":"string","minLength":3},"confidence":{"type":"number","minimum":0,"maximum":1}}},"candidate":{"type":"object","additionalProperties":false,"required":["id","createdAt","proposedBy","signalRefs","sourceProductRefs","problemStatement","economicHypothesis","primaryMetric","baseline","target","attributionWindow","currency","costModel","falsificationCondition","contentDigest"],"properties":{"id":{"type":"string","pattern":"^ECOHYP-[A-Z0-9-]+$"},"createdAt":{"type":"string","format":"date-time"},"proposedBy":{"$ref":"#/$defs/actor"},"signalRefs":{"type":"array","minItems":1,"uniqueItems":true,"items":{"type":"string","pattern":"^RSIG-[A-Z0-9-]+$"}},"sourceProductRefs":{"type":"array","minItems":1,"uniqueItems":true,"items":{"type":"string","pattern":"^(PROD|PREC)-[A-Z0-9-]+$"}},"problemStatement":{"type":"string","minLength":10},"economicHypothesis":{"type":"string","minLength":10},"primaryMetric":{"type":"string","minLength":3},"baseline":{"type":"object","additionalProperties":false,"required":["status","value","measurementWindow"],"properties":{"status":{"enum":["UNKNOWN","MEASURED"]},"value":{"type":["number","null"]},"measurementWindow":{"type":"string","minLength":3}}},"target":{"type":"object","additionalProperties":false,"required":["value","measurementWindow"],"properties":{"value":{"type":"number"},"measurementWindow":{"type":"string","minLength":3}}},"attributionWindow":{"type":"string","minLength":5},"currency":{"type":"string","pattern":"^[A-Z]{3}$"},"costModel":{"type":"object","additionalProperties":false,"required":["includeVariableCosts","includeAcquisitionCosts","includeExperimentCosts"],"properties":{"includeVariableCosts":{"type":"boolean"},"includeAcquisitionCosts":{"type":"boolean"},"includeExperimentCosts":{"type":"boolean"}}},"falsificationCondition":{"type":"string","minLength":10},"contentDigest":{"type":"string","pattern":"^sha256:[a-f0-9]{64}$"}}},"decision":{"type":"object","additionalProperties":false,"required":["id","decidedAt","decidedBy","candidateRef","candidateDigest","verdict","independence","rationale","requiredEvidence"],"properties":{"id":{"type":"string","pattern":"^ECODEC-[A-Z0-9-]+$"},"decidedAt":{"type":"string","format":"date-time"},"decidedBy":{"$ref":"#/$defs/actor"},"candidateRef":{"type":"string","pattern":"^ECOHYP-[A-Z0-9-]+$"},"candidateDigest":{"type":"string","pattern":"^sha256:[a-f0-9]{64}$"},"verdict":{"enum":["APPROVE_EXPERIMENT","REJECT","REQUEST_MORE_EVIDENCE"]},"independence":{"type":"object","additionalProperties":false,"required":["isIndependent","rationale"],"properties":{"isIndependent":{"type":"boolean"},"rationale":{"type":"string","minLength":5}}},"rationale":{"type":"string","minLength":10},"requiredEvidence":{"type":"array","items":{"type":"string","minLength":3}}}},"evidence":{"type":"object","additionalProperties":false,"required":["id","kind","capturedAt","producer","locator","supports","confidence"],"properties":{"id":{"type":"string","pattern":"^BEVD-[A-Z0-9-]+$"},"kind":{"enum":["analytics","pos","receipt","manual_count","variable_cost","acquisition_cost","experiment_cost"]},"capturedAt":{"type":"string","format":"date-time"},"producer":{"$ref":"#/$defs/actor"},"locator":{"type":"string","minLength":1},"supports":{"type":"string","minLength":5},"confidence":{"type":"number","minimum":0,"maximum":1}}},"outcome":{"type":"object","additionalProperties":false,"required":["id","assessedAt","candidateRef","status","evidenceRefs","currency","attributableOrders","attributableRevenue","attributionMethod","windowStart","windowEnd"],"properties":{"id":{"type":"string","pattern":"^BOUT-[A-Z0-9-]+$"},"assessedAt":{"type":"string","format":"date-time"},"candidateRef":{"type":"string","pattern":"^ECOHYP-[A-Z0-9-]+$"},"status":{"enum":["PENDING","CONFIRMED","REFUTED","INCONCLUSIVE"]},"evidenceRefs":{"type":"array","uniqueItems":true,"items":{"type":"string","pattern":"^BEVD-[A-Z0-9-]+$"}},"currency":{"type":"string","pattern":"^[A-Z]{3}$"},"attributableOrders":{"type":"integer","minimum":0},"attributableRevenue":{"type":"number","minimum":0},"attributionMethod":{"type":"string","minLength":5},"windowStart":{"type":"string","format":"date-time"},"windowEnd":{"type":"string","format":"date-time"}}},"economics":{"type":"object","additionalProperties":false,"required":["id","calculatedAt","outcomeRef","status","evidenceRefs","currency","attributableRevenue","variableCosts","acquisitionCosts","experimentCosts","netContribution","formulaVersion"],"properties":{"id":{"type":"string","pattern":"^UECO-[A-Z0-9-]+$"},"calculatedAt":{"type":"string","format":"date-time"},"outcomeRef":{"type":"string","pattern":"^BOUT-[A-Z0-9-]+$"},"status":{"enum":["ESTIMATED","CONFIRMED"]},"evidenceRefs":{"type":"array","uniqueItems":true,"items":{"type":"string","pattern":"^BEVD-[A-Z0-9-]+$"}},"currency":{"type":"string","pattern":"^[A-Z]{3}$"},"attributableRevenue":{"type":"number","minimum":0},"variableCosts":{"type":"number","minimum":0},"acquisitionCosts":{"type":"number","minimum":0},"experimentCosts":{"type":"number","minimum":0},"netContribution":{"type":"number"},"formulaVersion":{"const":"net-contribution.v0"}}},"record":{"type":"object","additionalProperties":false,"required":["id","status","decisionRef"],"properties":{"id":{"type":"string","pattern":"^PREC-ECO-[A-Z0-9-]+$"},"status":{"enum":["EXPERIMENT_APPROVED","MEASURING","SCALE","STOP","PIVOT","REJECTED","SUPERSEDED"]},"decisionRef":{"type":"string","pattern":"^ECODEC-[A-Z0-9-]+$"},"businessOutcomeRef":{"type":"string","pattern":"^BOUT-[A-Z0-9-]+$"},"unitEconomicsRef":{"type":"string","pattern":"^UECO-[A-Z0-9-]+$"},"supersedes":{"type":"string","pattern":"^PREC-ECO-[A-Z0-9-]+$"}}},"snapshot":{"type":"object","additionalProperties":false,"required":["snapshotId","generatedAt","activeRecordRefs","unresolvedCandidateRefs","sourceRecordRefs"],"properties":{"snapshotId":{"type":"string","pattern":"^PSNAP-ECO-[A-Z0-9-]+$"},"generatedAt":{"type":"string","format":"date-time"},"activeRecordRefs":{"type":"array","uniqueItems":true,"items":{"type":"string","pattern":"^PREC-ECO-[A-Z0-9-]+$"}},"unresolvedCandidateRefs":{"type":"array","uniqueItems":true,"items":{"type":"string","pattern":"^ECOHYP-[A-Z0-9-]+$"}},"sourceRecordRefs":{"type":"array","uniqueItems":true,"items":{"type":"string","pattern":"^PREC-ECO-[A-Z0-9-]+$"}}}}}}
