{"schemaVersion":"profit-traceability.bundle.v0","bundleId":"PTBIZ-ROBYS-MENU-TO-VISIT-001","product":{"productId":"PROD-ROBYS-WEB","name":"Roby's"},"economicSignal":{"id":"RSIG-ROBYS-MENU-TO-VISIT-001","observedAt":"2026-07-04T02:00:00+03:00","observer":"product-strategy","summary":"The current system cannot attribute website or menu changes to store visits, orders, revenue, or contribution profit.","source":"governance-gap:missing-baseline-and-order-attribution","confidence":1.0},"candidate":{"id":"ECOHYP-ROBYS-MENU-TO-VISIT-001","createdAt":"2026-07-04T02:15:00+03:00","proposedBy":"product-strategy","signalRefs":["RSIG-ROBYS-MENU-TO-VISIT-001"],"sourceProductRefs":["PROD-ROBYS-WEB"],"problemStatement":"Roby's cannot currently attribute website or menu changes to store visits, orders, revenue, or contribution profit.","economicHypothesis":"A clearer map call-to-action plus a time-bounded combo offer may increase attributable store visits and positive net contribution.","primaryMetric":"attributable_orders","baseline":{"status":"UNKNOWN","value":null,"measurementWindow":"7 days before experiment"},"target":{"value":20,"measurementWindow":"7 days after experiment"},"attributionWindow":"A visit or order within 24 hours of the tracked web action","currency":"TRY","costModel":{"includeVariableCosts":true,"includeAcquisitionCosts":true,"includeExperimentCosts":true},"falsificationCondition":"The hypothesis is refuted if attributable orders do not increase or if confirmed net contribution is zero or negative.","contentDigest":"sha256:a2c18c5908a5db703ddeebb3ea398a88e8832e48c0567169f5a5c64315b9c8e5"},"decision":{"id":"ECODEC-ROBYS-MENU-TO-VISIT-001","decidedAt":"2026-07-04T02:20:00+03:00","decidedBy":"independent-economic-review","candidateRef":"ECOHYP-ROBYS-MENU-TO-VISIT-001","candidateDigest":"sha256:a2c18c5908a5db703ddeebb3ea398a88e8832e48c0567169f5a5c64315b9c8e5","verdict":"REQUEST_MORE_EVIDENCE","independence":{"isIndependent":true,"rationale":"The reviewer is separate from the candidate author and does not infer profit from product activity."},"rationale":"Without a measured baseline, durable order attribution, and cost evidence, the system cannot approve a profit experiment or claim unit economics.","requiredEvidence":["Measured baseline menu-to-order conversion","Durable tracked web-action to order attribution","Attributable revenue from POS or receipts","Variable cost per attributable order","Acquisition and experiment costs"]},"businessEvidence":[],"businessOutcome":null,"unitEconomics":null,"record":null,"snapshot":{"snapshotId":"PSNAP-ECO-ROBYS-001","generatedAt":"2026-07-04T02:25:00+03:00","activeRecordRefs":[],"unresolvedCandidateRefs":["ECOHYP-ROBYS-MENU-TO-VISIT-001"],"sourceRecordRefs":[]}}
